Name,Description,Ecosystem,Spec. Issue,Components,Interfaces,Source
R1 Interface Specification Gaps,"As explained in chapter 2.3.4, the R1 interface is used by the rApps to access non-real-time RIC functions and other services that an rApp needs to fulfil its tasks. Here, the following is envisaged: “The R1 interface is the sole interface between an rApp and the functionality of the Non-RT RIC and SMO. Therefore, the R1 interface should be defined to meet all functional needs of rApps, with appropriate interface extensibility capabilities as needed.” [29]. The R1 interface is thus to be regarded as very powerful. At the same time, it is currently largely unspecified. There are some general statements and some requirements, but no concrete design. The following information is relevant from a security point of view:

- “It would be useful for the O-RAN Alliance to define an open and standard interface through which the Non-RT RIC exposes SMO Framework functionalities to 'rApps' via the R1 Services exposure functionality. We will refer to this as the 'R1' interface” [29]
- ""Capabilities are offered for consumption and usage through the R1 services. Such services include, but are not limited to: A1-related services, O1-related services, O2related services, ...” [29]

The way in which the interface is designed is also unclear. A certain assumption can be made that the API calls are internal and do not take place via a network interface between different computers. Among other things, this assumption arises from the fact that the R1 interface is not mentioned in various O-RAN documents regarding the new, open interfaces. Conversely, based on the general definition of the R1 interface – “R1 Interface: Interface between rApps and Non-RT RIC framework via which R1 Services can be produced and consumed” [58] – it cannot be ruled out that the R1 interface is implemented as a network-based interface. Within the framework of this study, it is therefore assumed with regard to the best-case scenario that the R1 interface only deals with internal APIs; in the worst-case consideration, it is assumed that the R1 interface is accessible via the network.

Security safeguards are not currently specified for the R1 interface. It is only mentioned with regard to rApps that access to R1 services should only be possible after authentication and authorisation. Details on how this is to be implemented are also not specified at present. Due to the principle connection of O1, O2 and A1 services and the lack of current restrictions regarding the use of these interfaces, the risk analysis for the R1 interface is based on the results for the O1, O2 and A1 interfaces. The highest risk for one of these interfaces is regarded as the lower bound of the respective risk for the R1 interface. From a risk perspective, the R1 interface cannot be better than the O1, O2 or A1 interface (in the worst case).

It should also be noted that for the best-case/worst-case considerations, the situation regarding the O-RAN specifications is decisive. In the O-RAN worst case, the O1/O2 interface can be used to take control of the O-RAN components. Therefore, any 3GPP security safeguards implemented in this case can barely take effect, or they can be circumvented. Conversely, in the O-RAN best case, misuse of the R1 interface is prevented, which is why the implementation of 3GPP protective measures is less crucial. One exception here is the telco perspective with regard to the protection goal of confidentiality: in the best case, the Control Plane is afforded end-to-end protection, which also offers protection in the O-RAN worst case.",FALSE,TRUE,,R1 Interface,Open RAN Risk Analysis
E2 Interface Specification Gaps,"As detailed in chapter 2.3.5, the E2 interface is primarily used to manage the E2 nodes. In the course of this, a service (“RAN Function Network Interface (NI)” [59]) makes it possible to observe and change all data traffic on the network interfaces of the E2 nodes with the help of the E2 interface. Among other things, the following specific services are offered:

- “Copy of Complete message with header providing network interface type, identifier and direction with optional network interface timestamp”
- “Injection of Complete message with header providing target network interface type, identifier and direction and optional RIC Control Message Priority”

These services present a high risk potential from a security perspective. Meanwhile, the security safeguards provided for in the specification are currently considered optional. One specific requirement states that the E2 interface “shall support confidentiality, integrity and replay protection” [30]. A similar statement is also found in [51]. IPSec is proposed as a means of protection in [49]: “IPSEC: Should be used to protect E2 traffic” (similarly in [51]: “For the security protection at the IP layer on E2 interface, IPsec shall be supported”).  Based on the functional capabilities of the E2 interface and the corresponding security safeguards, the associated risks are assessed below.",FALSE,TRUE,,E2 Interface,Open RAN Risk Analysis
E2 Interface Attack (A),"O-RAN worst case/3GPP worst case (ww): Since no security safeguards are implemented in the worst case – apart from integrity protection of the Control Plane data – and the E2 interface allows full access to all 3GPP data traffic on the E2 nodes, a high risk to confidentiality, availability and accountability is essentially assumed for all stakeholders. With regard to “telco” stakeholders, a medium risk is assumed due to the 3GPP integrity assurance of the Control Plane data, as O-RAN-specific (configuration) data is unprotected at the same time.",FALSE,TRUE,,E2 Interface,Open RAN Risk Analysis
E2 Interface Attack (B),"O-RAN worst case/3GPP best case (wb): The situation changes here, as the 3GPP security safeguards offer protection related to the protection goals of confidentiality, integrity and accountability. The only question here is the extent to which “insider” attackers can gain access to the keys for securing the User Plane or to the unencrypted User Plane data. In principle, the corresponding keys are available in the CU. Further analyses are required to be able to exclude such risks with certainty, which is why the risks at hand are assessed as “medium”.",FALSE,TRUE,,E2 Interface,Open RAN Risk Analysis
E2 Interface Attack (C),"O-RAN best case/3GPP best case (bb): In the best case, the E2 interface and the 3GPP interfaces are secured. An outsider can therefore essentially only carry out denial-of-service attacks on the E2 interface. A low risk to confidentiality, integrity and accountability is therefore assumed for all stakeholders.

“Stupid” DoS attacks only have a limited effect here, as the O-RAN specifications stipulate that the RAN should be functional even if the E2 interface fails. However, it must be assumed that the RAN is functional with a limited quality of service – otherwise there would be no need for an E2 interface. Furthermore, the effects depend on the concrete design of the E2 node in question. By cleverly manipulating data traffic on the E2 interface, an attacker can achieve a high computing load at an E2 node due to the cryptographic operations associated with IPSec. In extreme cases (if separation is not implemented well), this could lead to insufficient computing power being available for the actual tasks of an E2 node. The extent to which “intelligent” DoS attacks can lead to a more severe impairment of quality of service also remains unclear. Attacks that deliberately delay data packets in such a way that the detection mechanisms regarding a failure of the E2 interface (timer, etc.) are not yet triggered are conceivable in this context. Furthermore, the extent to which it is possible to assign encrypted data traffic to individual E2 services or E2 functions in spite of IPSec encryption (for example, through traffic analyses regarding specific service communication traffic patterns) must also be investigated. This would enable the targeted disruption of individual E2 services or E2 functions and could lead to more severe effects compared to a complete “failure” of the E2 interface. Overall, the risk outsiders pose to availability is therefore considered medium with regard to all stakeholders.

At present, the position of “user” attackers is only slightly better. One new risk/threat stems from a user's ability to generate data traffic pertaining to the User Plane and Control Plane that can be regarded as legitimate in principle. The user can cleverly design this data traffic in such a way that it is included in the analysis and evaluation functions provided by the E2 interface (with regard to the 3GPP interfaces). Depending on how concrete these analysis and evaluation functions are, this influence can be seen as a springboard for further attacks. This is especially the case if the corresponding systems were not developed on the premise that recorded analysis and evaluation data should be regarded as potentially malicious in principle. For example, cleverly crafted User Plane or Control Plane data could be used for buffer overflow or injection attacks (SQL injection, etc.). It is also possible to influence the training of machine learning based on recorded data. Overall, such attacks are likely to primarily impact availability at first. However, since it is assumed in principle within the framework of the bestcase analysis that all systems work without errors, the overall risk assessment is not higher than in the case of an “outsider” attacker.

In the context of an insider, the attacker is assumed to have access to the E2 interface. A good example of this is an xApp. There is general talk of “policies” and “authorisations” with regard to xApps here and there in the specifications, but since there is no differentiation at all and no rights management is apparent with regard to the current specification of the E2 interface, it is currently assumed that an xApp can use the E2 interface without restriction, even in the bestcase scenario. If this is not the case for an xApp, it is very likely to be for the near-real-time RIC component.

Due to the assumed access to the E2 interface, availability attacks are easily possible for an insider, resulting in a high risk for all stakeholders. In terms of confidentiality, integrity and accountability, the perspective of an end user depends on which component the insider controls. If this component has both access to the E2 interface and knowledge of the keys used to secure the Uu interface, the risk is high. If the insider cannot access the cryptographic keys, the risk is low. As a general consequence, a medium risk is assumed here. This risk assessment is also adopted for the “state” stakeholder. With regard to the “telco” stakeholder, the situation is somewhat better on the one hand, since the Control Plane data traffic is secured from end to end. On the other hand, the E2 interface enables the “exposure of selected E2 Node data (e.g. configuration information (cell configuration, supported slices, PLMNs etc.), network measurements, context information, etc.) towards the Near-RT RIC” [30]. This data is regarded as sensitive trade secrets and, since it forms a basis for network operation, the data's integrity is considered important. A medium risk to the protection goals of confidentiality, integrity and accountability is therefore assumed with regard to the “telco” stakeholder.",FALSE,TRUE,,E2 Interface,Open RAN Risk Analysis
E2 Interface Attack (D),"O-RAN best case/3GPP word case (bw): Since the E2 interface is secured in the O-RAN best case, there are no direct options for “user” and “outsider” attackers to use the E2 interface for attacks. For an insider, accessing an E2 interface with no 3GPP security safeguards makes it possible to successfully breach almost every protection goal from nearly any perspective (again, with the exception of the integrity protection of the Control Plane data, which is also present in the 3GPP worst case). This results in a correspondingly high risk.",FALSE,TRUE,,E2 Interface,Open RAN Risk Analysis
Open Fronthaul M-Plane Software Injection Attacks,"The Open Fronthaul M-Plane interface makes it possible to manage the O-RU components as described in chapter 2.3.7. Particularly relevant from a risk perspective is the possibility of using the Open Fronthaul M-Plane interface to perform a software update with regard to the O-RU components. In principle, this enables an attacker to take full control of the O-RU by importing appropriately manipulated software. In accordance with the O-RAN specification, software protection is not strictly defined: “The use of compression and ciphering for the content of the software build is left to vendor implementation. The only file which shall never be ciphered is the manifest.xml file” [32]. However, the manifest in particular contains information that should be protected from manipulation. A special risk arises from the fact that with the help of the Open Fronthaul M-Plane interface, the download URL can be freely specified with regard to the software to be installed. It would be better to provide for restrictions here so that the configured host in the O-RU (for example) is “fixed”, which would limit the negative effects of possible manipulations in the transmission of the download URL (redirection to a server under the control of the attacker).",FALSE,TRUE,O-RU,Fronthaul Interface,Open RAN Risk Analysis
Open Fronthaul M-Plane Configuration Attacks,"In addition, it is assumed that access to the Open Fronthaul M-Plane interface facilitates successful attacks on availability, since the configuration data stored in the O-RU can be changed with the help of the Open Fronthaul M-Plane interface. This in turn can be used to impair quality of service or cause a complete functional failure of the O-RU.",FALSE,TRUE,O-RU,Fronthaul Interface,Open RAN Risk Analysis
OFH-M Security Specification Gap,"In contrast to almost all other interfaces, the considerations for securing the Open Fronthaul M-Plane interface are comparatively extensive and could even be seen as mandatory depending on one's interpretation. Specifically, the use of SSH (for which support is mandatory) or TLS (optional) is possible here. To minimise risk, the use of SSH should be dispensed with in favour of TLS (as already detailed in connection with the O1 and O2 interfaces). With regard to security, mutual authentication is mandatory.

The room for interpretation regarding mandatory applicable security mechanisms is mainly due to the unclear wording in the specification documents, such as in the statement: “The M-Plane provides end to end security as a mandatory feature.” [32] However, a “feature” is a property or capability of a component and therefore does not have to be applied. In contrast, a subsequent table states that the protection goals of confidentiality, integrity and accountability are implemented – however, the reason given here only refers to the basic support for SSH or TLS, but not to their mandatory use. As listed later in the table “Mandatory and Optional Features for O-RU Authentication”, all authentication mechanisms are marked as “optional to use”. It would be better to clarify here – if this is the intention of the specification – that although each individual mechanism is optional, at least one is mandatory.",FALSE,TRUE,,Fronthaul Interface,Open RAN Risk Analysis
OFH-M Default Credentials for Privileged Accounts,"Overall, however, the Open Fronthaul M-Plane interface contains many considerations with regard to security. It should be noted here that the description of the Open Fronthaul interfaces is also significantly more extensive overall compared to the other interfaces.

With regard to security, it should also be mentioned that a rights/roles concept is provided. There are six roles mentioned in the specification:
- sudo
- smo
- hybrid-odu
- nms
- fm-pm
- swm

With regard to the rights, a distinction is made between read, write, and execute. The rights for various functional groups (referred to as “namspace” in the specification) are then determined on the basis of the role in question. The role “sudo” has the most privileges. It is intended as an administrative role and thus grants full access to the O-RU, including the option to create users and assign roles to them.

The fact that a default user with a default password and “sudo” rights is provided for out-ofthe-box is not considered advisable with regard to the current specification. In the literature, it is frequently reported that default access of this kind is a starting point for successful attacks – no matter how strongly users are advised to change their default access data during initial setup. Here, mechanisms should be provided that enable initial setup without a known default user name and password – for example, by randomly generating this data and attaching it to the O-RU as documentation.",FALSE,TRUE,O-RU,Fronthaul Interface,Open RAN Risk Analysis
OFH-M Attack (A),"O-RAN worst case/3GPP worst case (ww): Assuming that the O-RAN security safeguards are also mandatory in the worst case, “user” and “outsider” attackers pose a low risk to the protection goals of confidentiality, integrity and accountability for all stakeholders. However, due to the unclear formulations and the associated uncertainty as to whether the O-RAN security safeguards really have to be implemented, they are upgraded to a medium risk. Similarly, a medium risk is assumed with regard to availability, since availability attacks on the Open Fronthaul M-Plane interface are possible as previously described for the other interfaces. Since no explicit statements regarding the tolerance of a failure of the Open Fronthaul M-Plane interface could be found, it is also assumed with regard to the Open Fronthaul M-Plane interface that cleverly executed availability attacks can lead to an impairment of RAN service quality.

With regard to “insider” attackers, the situation is somewhat different. An insider with access to the Open Fronthaul M-Plane interface can update the software on the O-RU components, which in turn gives them access to the User Plane and Control Plane data transmitted via the Uu interface. As this data is not protected further in the worst case, it is fully exposed to manipulation – hence the assessment of the corresponding risk as “high” for all stakeholders. Only the integrity of the Control Plane data exchanged between UE and AMF is unaffected by this. Since this data has mandatory integrity protection, the related risk is low. However, it is assumed that there is also (network management) data in the O-RU that is sensitive from the telco point of view (with regard to confidentiality, integrity and accountability) and can be accessed by an insider. Therefore, a medium risk is assumed overall.",FALSE,FALSE,O-RU,Fronthaul Interface,Open RAN Risk Analysis
OFH-M Attack (B),"O-RAN worst case/3GPP best case (wb): Here, the assessment is similar to the worstcase/worst-case scenario. There are some improvements due to the User and Control Plane data, which is secured by the 3GPP measures in this case. As a result, an insider cannot break the confidentiality or integrity of the Control Plane data, which is why the risk here is also assessed as medium overall. It is also assumed that the User Plane data is protected, since insiders are assumed to be the O-RU or O-DU and neither has access to the cryptographic keys used to secure the User Plane.",FALSE,FALSE,,Fronthaul Interface,Open RAN Risk Analysis
OFH-M Attack (C),"O-RAN best case/3GPP best case (bb): The assessments regarding “outsider” and “user” attackers follow from the already very positive risk assessment in the worst case. In the case of an insider, the attacker does have access to the Uu interface, but the data (as explained previously) is protected by the 3GPP measures in the best case, which is why the risk of violating the protection goals of confidentiality, integrity and accountability is rated as low.",FALSE,FALSE,,Fronthaul Interface,Open RAN Risk Analysis
OFH-M Attack (D),"O-RAN best case/3GPP worst case (bw): With regard to “user” and “outsider” attackers, the O-RAN security safeguards prevent successful attacks on the confidentiality, integrity, accountability and privacy of User and Control Plane data. The corresponding risk is thus low. With regard to “insider” attackers (who have access to the O-RU), a high risk arises due to the non-existent protection of the User Plane data. For the network operator, the risk to confidentiality is the same, whereby integrity is again secured by the mandatory safeguards on the Control Plane data between UE and AMF. The same does not apply to the management data in the O-RU or O-DU.",FALSE,FALSE,,Fronthaul Interface,Open RAN Risk Analysis
OFH CUS Attack (A),"3GPP worst case (ww): Access to the Open Fronthaul CUS-Plane interface enables an attacker to gain full access to the unprotected User and Control Plane data of the Uu interface. “Outsider” attackers thus pose a high risk for all stakeholders. A lower risk can only be assumed for the integrity of the Control Plane data due to the end-to-end protection between UE and AMF. However, this does not affect the integrity of the O-RAN-specific management data or, in particular, that of the very important time synchronisation data (see also chapter 2.3.6.3).",FALSE,FALSE,,Fronthaul Interface,Open RAN Risk Analysis
OFH CUS Attack (B),"3GPP best case (bb): For the “user” perspective, the situation improves in the best case with regard to the protection goals of confidentiality, integrity and accountability, since the Uu interface is secured by 3GPP security safeguards. In the case of accountability, the risk is assessed as medium, since 3GPP does not provide any protective measures in this regard and a user (in contrast to an “outsider” attacker) can import User Plane messages into the system that are recognised as correct during integrity checks.

Availability attacks on the Open Fronthaul CUS Plane interface also impact the usability of the 5G system as a whole, which is why a high risk to availability is assumed even in the bestcase scenario.

The 3GPP protections ensure that “insider” attackers also pose a low risk to the User Plane data transmitted on the Uu interface, since the symmetric keys used for protection are located in the O-CU.

The Control Plane data exchanged between UE and AMF is secured by the safeguards provided in the 3GPP best case, resulting in a lower risk for the network operator. However, the time synchronisation data (S-PLANE) is not secured in the 3GPP best case either, so that there is at least a medium risk here overall with regard to the protection goal of integrity.",FALSE,FALSE,,Fronthaul Interface,Open RAN Risk Analysis
OFH CTI Attack,"The CTI interface facilitates capacity reservation in the transport network that is used for the Open Fronthaul CUS plane. This is meant to ensure sufficient resources are always available to meet the high bandwidth and latency requirements of the Open Fronthaul CUS plane, especially in the case of a transport network shared with other services. It is currently assumed that reconfiguration of the network paths themselves (using the CTI interface) is not planned. In this respect, attacks on or access to the CTI interface do not result in any violations of the protection goals of confidentiality, integrity, accountability or privacy. It should be noted that only a digital signature is currently provided as a safeguard for the CTI interface, and its exact specification will only be defined in the future (“The full details of the CTI Signature will be specified in a future version of this specification.”) [33] This makes it possible to ensure integrity and accountability. Confidentiality, on the other hand, is not guaranteed. An attacker may thus be able to obtain information about network management and related strategies by eavesdropping on the CTI interface, which must be taken into account in particular with regard to the “telco” stakeholder. It should be noted that the aforementioned digital signature is optional. Furthermore, it is unclear how the mechanism is to function in concrete terms. A bit is provided in the CTI header that signals whether a digital signature is being used. Since this bit itself is not protected, it remains unclear whether the intended digital signature can actually have a meaningful protective effect.

Since the availability of the 5G RAN (especially with regard to the Uu interface) is to be ensured with the help of the CTI interface, availability attacks on the CTI interface itself enable corresponding attacks on 5G RAN availability. In the worst case, “outsider” attackers are assumed to pose a high risk to all stakeholders. The best-case scenario, meanwhile, may indeed be somewhat better due to the digital signature. Since it is unclear whether the current design of the digital signature can actually have a meaningful protective effect, a medium risk is assumed – especially because attacks that suppress CTI messages are possible despite the digital signature and the current specifications do not explicitly take into account a failure of the CTI interface.",FALSE,TRUE,,Fronthaul Interface,Open RAN Risk Analysis
