Name,Description,Ecosystem,Spec. Issue,Components,Interfaces,Source
Software Supply Chain,"The major supply-chain attacks on commercial software vendors during the past two years heightens the need for vendors and CSPs to use secure development processes, DevSecOps approaches, end-to-end protection for CI/CD pipelines, signed code provenance, and other forms of protection.",FALSE,FALSE,ALL,,Security for Open RAN Architectures in 5G Telco Clouds
AI/ML Vectors,The use in the RAN of emerging technology like artificial intelligence can introduce new risks and expose new attack vectors.,FALSE,FALSE,ALL,,Security for Open RAN Architectures in 5G Telco Clouds
IoT Botnet Attacks,The rise of IoT and the proliferation of connected devices increases the risk of attacks by compromised devices.,FALSE,FALSE,ALL,,Security for Open RAN Architectures in 5G Telco Clouds
Disaggregated CU-DU,The disaggregation of the CU and DU presents a potential new attack vector in the open fronthaul interface that operates in the lower-layer split (LLS) interface.,FALSE,FALSE,,Fronthaul Interface,Security for Open RAN Architectures in 5G Telco Clouds
"Unauthorized Access to O-DU, O-CU","Unauthorized access to a component or a control or user plane, such as the DU or the CU control plane, to degrade RAN performance or attack network availability",FALSE,FALSE,"O-DU, O-CU",,Security for Open RAN Architectures in 5G Telco Clouds
Disabled Ciphers,Disabling over-the-air ciphers to eavesdrop on traffic.,FALSE,FALSE,UE,,Security for Open RAN Architectures in 5G Telco Clouds
Security-Latency Requirements,Strict latency requirements can affect how security controls like encryption are implemented and managed on the Open Fronthaul Interface.,FALSE,FALSE,,Fronthaul Interface,Security for Open RAN Architectures in 5G Telco Clouds
Sensitive RIC Data,An O-RAN architecture includes a real-time intelligent controller. The RIC is a new component that accesses user context and data about user usage -- sensitive data that requires extra protection. The RIC exposes this sensitive data to RAN applications developed by multiple vendors.,FALSE,FALSE,Near-RT RIC,,Security for Open RAN Architectures in 5G Telco Clouds
Third Party Application Conflicts,"Another potential vulnerability is Near-RT RIC conflicts with O-gNB, or conflicts between third-party applications.",FALSE,FALSE,Near-RT RIC,,Security for Open RAN Architectures in 5G Telco Clouds
Improper Isolation,Unprotected or poorly isolated management interfaces.,FALSE,FALSE,,ALL,Security for Open RAN Architectures in 5G Telco Clouds
Missing Trust and Code Provenance,Disaggregation can present vulnerabilities if hardware roots of trust and code provenance are not in use.,FALSE,FALSE,ALL,,Security for Open RAN Architectures in 5G Telco Clouds
Insecure Designs,"The inadvertent use of insecure designs, architectures, or interfaces.",FALSE,FALSE,ALL,,Security for Open RAN Architectures in 5G Telco Clouds
Misconfigurations,"Misconfiguration, insufficient isolation, weak authentication, or imprecise access control for applicable components and interfaces.",FALSE,FALSE,ALL,,Security for Open RAN Architectures in 5G Telco Clouds
Kubernetes Vulnerabilities,"Kubernetes, containers, the Linux container host operating system, the container image registry, and other cloud-native technology call for new skill sets. If improperly deployed or managed, CNFs and Kubernetes, like any other technology, can expose vulnerabilities or present new attack vectors.",FALSE,FALSE,"O-Cloud, SMO",,Security for Open RAN Architectures in 5G Telco Clouds
Container Vulnerabilities,"Container images for CNFs and 5G services require code provenance and protection as they move through a CI/CD pipeline. If container images are not stored securely, protected by role-based access control, scanned for vulnerabilities, and signed as trusted, container images can contain vulnerabilities or exploits that surface after deployment.",FALSE,FALSE,"O-Cloud, SMO",,Security for Open RAN Architectures in 5G Telco Clouds
xApp Supply Chain Attacks,An xApp could be compromised through the supply chain or  by hijacking the onboarding process.,FALSE,FALSE,Near-RT RIC,,Opening Critical Infrastructure: The Current State of Open RAN Security
Unexpected xApp Messages,Even a benign xApp can cause harm if it sends out unexpected or anomalous messages.,FALSE,FALSE,Near-RT RIC,,Opening Critical Infrastructure: The Current State of Open RAN Security
RMR Spoofing,RMR spoofing and hijacking could disrupt the xApp ecosystem in RIC without shutting down any component.,FALSE,FALSE,Near-RT RIC,,Opening Critical Infrastructure: The Current State of Open RAN Security
R1. Misconfiguration  of networks,"The fact that more components from different suppliers need to be integrated together, the use of virtualisation management and the lack of mature MNO processes for complete lifecycle of Open RAN deployment greatly increase configuration complexity and the risk of misconfiguration of networks and render faults more likely. Moreover, the lack of mature standards can lead to dissimilar and potentially poorer network design and architecture which increases the risk for ineffective emergency and continuity mechanisms. Decoupling hardware and software, and using software component from different suppliers present potential additional risk of misconfiguration of networks. Software may offer security feature, which relies on hardware implemented secure element, or security feature which requires support from other software component. As there may be many different combinations of software and hardware, or combinations of software components, integrating the security features may require additional effort and could easily end up to situations in which security features are not used.",FALSE,FALSE,ALL,ALL,Report on the Cybersecurity of Open RAN
R2. Lack of access  controls,The increased number of Open RAN suppliers also means an increasing number of third parties needing access to the network (e.g. in case of malfunction). The new functions (for example xApps and rAPPs) will introduce new suppliers in the ecosystem and will require additional security controls and measures to be put in place between each and every function to avoid new security threats being introduced. MNOs may need to outsource the operations to third parties given the increased complexity and additional interfaces in Open RAN deployments. The use of open interfaces also increases the risk of a third party accessing the system.,FALSE,FALSE,"Near-RT RIC, Non-RT RIC",,Report on the Cybersecurity of Open RAN
New Risk (NR) 1. Expanded threat surface and vulnerabilities in Open RAN functions and interfaces,"The increased number of components in Open RAN deployments, potentially from multiple suppliers, together with new network functions as well as additional Lower Layer Split (LLS) interfaces, increase the attack surface. Also, the implementation of network functions with AI and ML introduces new attack vectors, for example through flaws in the ML model or via the interface to external sources (such as weather data). For instance, the O-RAN Alliance specifications, in their current version, include the possibility for external, potentially untrusted, sources to provide data to intelligent RAN functions and to configure the network intelligently, but these interfaces have not been further defined/described. Vulnerabilities in these interfaces and intelligent functions could negatively impact the network. In addition, by opening certain interfaces, Open RAN will give access to information flows to new third-party applications, which raises security issues with regard to data passing through the network. The O-RAN specifications already define capacities for opening certain interfaces to thirdparty applications. These openings aim to introduce new functionalities, but these third-party applications will have access to information flows (e.g. real-time location data of users connected to the network).

Risk Scenario: Adversary exploits insecure open fronthaul interface to mount denial of service, interception or tampering attacks, compromising availability, confidentiality, integrity or privacy of data. Alternatively, attackers may exploit weak authentication mechanisms to gain unauthorised access, compromise privacy, degrade network performance or facilitate attacks on other parts of the network.",TRUE,TRUE,ALL,ALL,Report on the Cybersecurity of Open RAN
R3. Low product  quality,"Open RAN means that there will be more suppliers and more different components, potentially including components from high-risk suppliers. This means that the risk of diverse levels of quality product increases. It is unclear whether newcomers in the Open RAN market might prioritise innovation or security in the short-term. In addition, there may be suppliers whose maturity of software development, software security and supply chain security is lagging behind with respect to more established suppliers. A compounding factor is the fact that Open RAN standards are still under development and lacking maturity. This means that Open RAN products may lack a foundation of security-by-design. Considering that these components are interconnected, additional controls will be needed to avoid that these weakest links put other components and the other RAN functions at risk.",TRUE,FALSE,ALL,ALL,Report on the Cybersecurity of Open RAN
R4. Dependency,"An increased number of available suppliers, coupled with a disaggregated RAN, interoperable interfaces, an increased use of COTS hardware and possibly open source software could reduce the overhead in switching suppliers, allowing operators to reduce the potential for dependency on any single suppliers (See also under ‘Supplier diversity in the RAN’ in annex 2).",TRUE,FALSE,ALL,ALL,Report on the Cybersecurity of Open RAN
NR2. New dependency on cloud service/infrastructure providers in Open RAN,"A potential (and likely) implementation of Open RAN's modular approach for the RAN functions, and the disaggregation of software from hardware, enables (part of) the base station software to be run on cloud platforms, which could increase dependency on cloud service/infrastructure providers. As different suppliers may use different cloud platforms, there is a risk that the network becomes dependent on multiple cloud service/infrastructure providers at the same time. There is a possibility that the cloud service or part of it is run outside the EU where different legislation may apply. There may be also situations where all MNOs in a region end up using the same cloud provider. In this case, even if each of the MNOs has its own network, all the networks are relying on the same cloud provider, which could then exacerbate vulnerabilities.  Risk scenario: Mobile network operators rely entirely on a small number of (mostly non-EU) cloud service/infrastructure providers for their Open RAN network supporting critical infrastructure, which creates a supplier lock-in.",TRUE,FALSE,"O-Cloud, SMO",,Report on the Cybersecurity of Open RAN
NR3. Decreased sustainability of the EU 5G supply chain and potential dependencies on non-EU capacities,"The RAN supply market could be transformed in a way that gives momentum to new players (e.g. system integrators, cloud service/infrastructure providers, etc.), including large non-EU players. This could lead to new critical dependencies in the midto long term, or increase existing ones30, with potentially significant impacts on security.  Risk scenario: New business models based on Open RAN architectures and interfaces gain momentum and new major players enter the market, competing with the established players. The market could reconsolidate around a small number of non-EU suppliers, system integrators and cloud providers, thus negating the diversification opportunity.",TRUE,FALSE,ALL,,Report on the Cybersecurity of Open RAN
NR4. Deficiencies in the O-RAN technical specifications development process,"Security has not been at the forefront of the technical specifications development process of the O-RAN Alliance31 32. Immature O-RAN specifications without a foundation of secure by design may lead to products with increased vulnerabilities leading to exploitation. The lack of mature security specifications in a diverse Open RAN architecture coupled with increased competition can result in poorly manufactured components in an attempt to reduce cost. In addition, key decision rights within the O-RAN Alliance are conferred to the Board, which is composed only of a sub-set of members and only of MNOs. The participation in the specification development of the O-RAN Alliance seems to narrow as the process advances. The combination of conditions for document access and for membership seems to imply that while the documents may eventually be accessed by anyone, conditions to access specifications are more stringent for non-members and non-contributors. The stringent provisions of the O-RAN Alliance Adopter License Agreement might hamper the transfer of information and knowledge between adopters and non-adopters, making discussions outside the O-RAN Alliance more difficult.  

Risk scenario: O-RAN specifications continue to be developed in a setting which does not provide much visibility and openness to relevant stakeholders, and a lack of parity with the 3GPP international standardisation efforts. This weakens efforts towards ensuring a coherent secure architecture, can fragment the overall system security and create vulnerabilities in availability, integrity, confidentiality and privacy.",TRUE,TRUE,ALL,ALL,Report on the Cybersecurity of Open RAN
R5. State interference through 5G supply chain,"As there will be more suppliers in an Open RAN deployment (including possibly more high-risk suppliers), the potential exposure to a higher number of supply chain risks increases. The risk profile of a supplier - linked to the criteria identified in the EU Coordinated risk assessment (including the risk of interference by third country) - continues to be an important source of vulnerabilities. In addition, risks could exist also in relation to the source/actors providing inputs and data for the specification of open interfaces (see also NR.4 Deficiencies in the O-RAN technical specifications development process).",TRUE,FALSE,ALL,ALL,Report on the Cybersecurity of Open RAN
R6. Exploitation of 5G networks by organised crime,"The increased number of interfaces and suppliers would offer more opportunities for OCGs to enter and disrupt the network. In addition, smaller suppliers, such as those providing software services, may be more susceptible to be influenced by OCGs (or state actors). Moreover, the possible use of open source components could mean that the vulnerabilities are publiclyknown and could therefore be more easily exploited by malicious actors.",TRUE,FALSE,ALL,ALL,Report on the Cybersecurity of Open RAN
R7. Significant disruption of critical infrastructures or services,Identified risks related to Open RAN (in particular new vulnerabilities related to an increased number of suppliers and new interfaces which translate into a higher risk of exposure to network-level attacks compared to the established access network implementations) and the lack of fully mature security controls around Open RAN architecture and NFV mean that critical national infrastructures relying on 5G networks could also be more exposed to incidents. .,TRUE,FALSE,ALL,ALL,Report on the Cybersecurity of Open RAN
R8. Massive failure of networks due to interruption of electricity supply or other support systems,"This risk can affect the RAN, and the impact would depend on the split of functions in the 3GPP or Open RAN specifications. In case of power supply disruption, a network using a distributed architecture could be impacted at a larger extent due to the physical distance that exists between the physical equipment/hardware hosting central unit (CU) and/or distributed unit (DU) functionalities. It is therefore important to ensure that adequate energy back-up sources are installed in multiple physical points in order to protect service availability in a single/particular area.",FALSE,FALSE,ALL,,Report on the Cybersecurity of Open RAN
R9. IoT exploitation,"Open RAN components, the network functions running on them, but also for example virtualised MEC applications, would be vulnerable to attacks from connected terminals, such as IoT devices, but the risk would be similar for network components in an established RAN architecture.",FALSE,FALSE,ALL,,Report on the Cybersecurity of Open RAN
NR5. Open RAN network fault management complexity,"Failure in specific network components built by a specialised supplier may impact the entire network. Multiple suppliers may increase complexity and cost of managing network services and fault management, by making it more challenging to discover the cause of network failures or by requiring (remote) support provided by several different suppliers, hence increasing the risk. In addition, more Open RAN suppliers could mean it is harder to allocate and enforce liability to one or more suppliers.

Risk scenario: An unintentional system failure in one of the critical components built by a specialised supplier and the complexity of identifying and resolving the issue in the multi-vendor set-up impacts the availability causing prolonged outage of network services.",TRUE,FALSE,ALL,,Report on the Cybersecurity of Open RAN
NR6. Impact of Open RAN mix and match approach on network security and performance,"Integration of multiple supplier components into a single network, in particular in the lack of a mature standard, which by its nature enables efficient interoperability, can cause integration problems, prevent specific security controls to function or make it more difficult to conduct network testing. Moreover, an increasingly complex environment with multiple components from different suppliers and with multiple stakeholders involved makes it more challenging to ensure that only trusted and competent individuals are involved in network deployment, operation and maintenance. Additionally, the increased number of components and interfaces and/or the application of necessary resource-demanding protection mechanisms on those elements may also lead to degradation of overall performance or prevent specific use-cases dependant on performance such as ultra-reliable low latency communications (URLLC). Furthermore, the ability of the MNO to pursue a systematic approach to security controls across the network is impeded by a diversity of security mechanisms. In addition, different releases of the same software might be deployed in a heterogeneous way.

Risk scenario: Unintentional human error in operating and managing complex network environment or an intentional malicious action by a non-trustworthy third-party personnel with high access privileges lead to unavailability of network services or facilitate further attacks on other parts of the network.",TRUE,FALSE,ALL,,Report on the Cybersecurity of Open RAN
NR7. Resource sharing,"In Open RAN, different network functions are virtualised and are running on the same hardware, which means that potentially, if there are not sufficient controls in place, other network functions could be impacted by security issues with other new RAN functions running on the same pool of resources.  

Risk scenario: If one non-critical network function is running alongside other network functions on the same pool of hardware resources, then a security incident affecting the non-critical network function, for example an overload or distributed denialof-service (DDoS) attack, could impact the security of other network functions.",TRUE,FALSE,ALL,,Report on the Cybersecurity of Open RAN
Coordinated Vendor Disclosure,"Integration and compatibility between Open RAN components and functions from different vendors is critical to network security. Since it is crucial to update devices as quickly as possible, additional delays may introduce risks for network operators. For example, if a zeroday vulnerability is identified, vendors could release patches at different times. If one vendor’s device is patched in response to a critical vulnerability, and others are not, it could lead to incompatibility of network devices and loss of network service availability. Until all the vendors within a network release a patch for the exploit, the operator’s network may be vulnerable.",TRUE,FALSE,ALL,,Open Radio Access Network Security Considerations
Component Lifecycle,"When a network operator implements a change, such as an update, service implementation, or addition of a new component, they must ensure that there are no negative impacts to the network. While traditional networks require testing, Open RAN will introduce more complexity, which may present challenges for operators since that interoperability will need to be tested before each network change throughout the device’s lifecycle.",TRUE,FALSE,ALL,,Open Radio Access Network Security Considerations
Triaging Vulnerabilities,"When a vulnerability arises within an Open RAN network, identifying which vendor is responsible for addressing it may require more extensive coordination between vendors. In a traditional network with limited vendors, responsibility would fall on the vendor to identify and repair the issue. With an Open RAN network, it may be difficult to identity which vendor is responsible when there is component incompatibility that will require the operator to bring multiple vendors together to remediate the issue. Operators may be less likely to implement security changes if vendor coordination is too difficult or time consuming.",TRUE,FALSE,ALL,,Open Radio Access Network Security Considerations
Improper Implementation of Specifications,"Devices must utilize defined Open RAN standards and specifications that support the development of open interfaces, network flexibility, and multi-vendor network support. If a device is not configured to established Open RAN specifications and attempts to communicate with another device that is also not properly configured, it may cause communication failures and transmission delays within the network.",FALSE,FALSE,ALL,ALL,Open Radio Access Network Security Considerations
OFH Denial of Service,"The availability of a mobile network to provide service to a subscriber is an imperative for mobile operators. The ability to provide a mobile service is dependent on the availability of the Open Fronthaul. The Open Fronthaul attack surface comprises the real-time communication interfaces, management interfaces, and the Open Fronthaul network. From a security perspective, the Open Fronthaul must implement security controls to counter potential denial of service attacks against the ability of a mobile network to provide services.",FALSE,FALSE,,Fronthaul Interface,Open Radio Access Network Security Considerations
Unauthorized Access to OFH,"One security concern is unauthorized device access to the Open Fronthaul network. Only ORU radios, O-DU in the base station equipment, and other authorized network devices should operate on the Open Fronthaul. An unauthorized device on the Open Fronthaul could launch denial of service attacks on the RAN. Mitigations for unauthorized access include network access control mechanisms, hardening and other O-RU physical security measures, and access control on O-RU management functions.",FALSE,FALSE,,Fronthaul Interface,Open Radio Access Network Security Considerations
Insufficient Authentication for OFH,The O-RAN Alliance defined management interface for the O-RU allows the operator to optionally use certificate-based authentication with mutual TLS5 or password-based authentication with SSH. Password-based authentication is considered weak and vulnerable to brute force attacks. Weak authentication can be exploited by a malicious actor to gain access to the local system and move laterally across the network to gain access to northbound systems for greater visibility and control across the RAN. Authentication on the O-RAN Alliance defined management interface with mutual TLS (1.2 or 1.3) comprising Public Key Infrastructure (PKI) based X.509 certificates will move the O-RAN alliance defined management interface toward adopting an accepted industry best security practice.,FALSE,TRUE,,Fronthaul Interface,Open Radio Access Network Security Considerations
