Name,Description,Ecosystem,Spec. Issue,Components,Interfaces,Source
AI/ML Data Poisoning Attacks,"AI and ML algorithms in Open RAN components can behave unpredictably or maliciously when subject to “data poisoning attacks”, subtle changes to input data that could be indistinguishable from random noise. Therefore, AI and ML algorithms deployed in Open RAN components should be chosen, trained, deployed, and updated using approaches that harden them against data poisoning attacks. Open RAN also proposes AI and ML algorithms be implemented in a modular way to allow for independence and re-use across software components. For supervised algorithms, like Deep Neural Networks (DNNs), it is recommended that offline training with known data precedes deployment.

When AI and ML algorithms are introduced into a software system, they can present additional and novel vulnerabilities that need to be understood and mitigated. By “poisoning” the data input to an AI and ML algorithms, an attacker can induce effects ranging from denial of service by one or more Open RAN components to unexpected output from an AI or ML module that alters Open RAN behavior to the attacker’s benefit.  

Protecting AI/ML against data poisoning attacks is still a growing field of investigation. Appendix A list four widely referenced papers that will enable an experienced practitioner to develop, test, and deploy AI/ML algorithms that are robust against a variety of attacks. Appendix B lists published attacks on AI and ML used in RANs.",FALSE,FALSE,"Near-RT RIC, Non-RT RIC",,Open Radio Access Network Security Considerations
Cloud/5G RAN Operator Takeover,"The “cloud operator” and “5G RAN operator” attackers have prominent positions. Both ultimately have full control over the RAN: the 5G RAN operator by design, and the cloud operator because the current O-RAN specifications do not provide for security measures regarding untrusted cloud operators. It simply assumes that cloud operators can be trusted: “Administrators, integrators, operators and orchestrators must be trustworthy, ...” [49].  As a result, there are no differences in the O-RAN-related best-case/worst-case considerations with regard to “cloud operator” attackers. The same applies to “RAN operator” attackers, who, among other things, have full control over the O-RAN security safeguards. Therefore, only worst-case (ww) and best-case (bb) considerations are generally made below. 

Worst case: If none of the 3GPP or O-RAN security safeguards specified as optional are implemented, the risk of a breach is to be assessed as high for all protection goals and for all stakeholders, since in this case the cloud operator/5G RAN operator has full access to all processed data and full control over the data processing itself. The only exception here is the end-to-end protection of the Control Plane data with regard to integrity. This improves the situation for the 3GPP Control Plane data, but the internal O-RAN configuration and management data are unprotected, which results in a medium risk overall. 

Best case: Even the best-case situation is only negligibly better. For all stakeholders, failure to meet the protection goal of availability represents a high risk. From their perspective, end users must also assume a violation of the protection goals of confidentiality, integrity, privacy and accountability, since the cryptographic keys for securing the air interface (Uu) are known to the RAN. Since such an attack is easy to carry out across the board, a high risk is also seen with regard to “state” stakeholders and the violation of the protection goals of confidentiality, integrity, accountability and privacy. For the “telco” stakeholder – specifically from the Control Plane perspective – the situation is slightly better, as the corresponding Control Plane messages (NAS) between UE and the core network are end-to-end secured (between UE and the 5G core). However, manipulations of the O-RAN-specific configuration and management data are possible, resulting in the assumption of a medium risk overall.",FALSE,TRUE,ALL,ALL,Open RAN Risk Analysis
Compromised O-Cloud Access,"The O-Cloud is the central execution environment of the O-RAN components. As mentioned above, an untrustworthy cloud operator results in very high security risks. The same applies in the case of an O-Cloud compromised by an attacker. This is why effective security safeguards such as access control and separation are crucial. The O-RAN specifications only make a few stipulations here and even contain security-critical requirements. For example, the “Security Requirements” specification [51] contains only a recommended requirement for access control: “User should be authenticated and authorized.” On the positive side, isolation mechanisms certainly are required: “Means of isolation of control and resources among different users shall be implemented” – although such isolation mechanisms are ineffective without mandatory user authentication. In the O-RAN worst case, a risk situation arises with regard to “outsider” attackers that is comparable to the situation involving “RAN operator” attackers, since a compromised O-Cloud is essentially equivalent to full control over the O-RAN components. The best-case scenario from an O-RAN perspective cannot be assessed at present, as there are practically no security requirements for the O-Cloud.",FALSE,TRUE,O-Cloud,,Open RAN Risk Analysis
O2 Specification Gaps,"As described in chapter 2.3.2, the O2 interface is used to configure the O-Cloud and deploy the RAN components of O-RAN, i.e. the VNFs. The O2 interface can be considered very powerful in that it can be used to determine the entire execution environment and the software components that are executed. This is all the more true since the deployment scenarios and use cases found in the O-RAN documents provide for a great deal of flexibility, and the O2 interface must therefore be powerful enough to support this dynamic. Unauthorised access to the O2 interface has the potential to compromise the RAN, i.e. to give an attacker complete control over the entire RAN. 

A detailed risk assessment is currently difficult since requirements are only described or specified in terms of the services to be made available with the help of the O2 interface. The exact details of how the interface is designed, however – that is, which concrete protocols are used, and so on – are not specified (“The O2 services and their associated interfaces shall be specified in the upcoming O2 specification”. [27])

The authors of the O-RAN specifications are well aware that the O2 interface must be secured, as they have defined the general requirement REQ-O2-GEN-TLS-FUN-1 and REQ-SECO2-1. However, these are formulated in fairly “soft” terms: “Management Service providers and consumers that use TLS shall support TLS v1.2 or higher” [26]. The use of security protocols (specifically TLS) is therefore not prescribed in principle; only a minimum TLS version is specified if TLS is used. The associated explanatory description, “Communications between SMO and O-Cloud are secure”, [26] can thus be described as misleading, as it represents more a wish than a fact or requirement that can be derived from the specification.

In addition to simply securing the connection (e.g. with the help of TLS), it is also important to define exactly which components or roles are allowed to use which management and deployment services. Based on this, corresponding rights management and access control must be implemented. It is important that the O2 interface has to be designed to support implementation of the least privilege principle in a natural way, i.e. that the interface offers welldefined functions with well-defined parameters that enable sufficiently granular rights management. The opposite of this would be more of a general interface – remote access via SSH, for example. Here, a clear determination of the capabilities of a principally authorised person and the implementation of corresponding restrictions on said capabilities are very complex and error-prone.

As mentioned, the exact design of the O2 interface is unclear, but the O-RAN software community does provide a reference implementation. This is based on a number of existing software components, such as OpenStack, Kubernetes and ONAP. These basic components are highly complex on their own, which makes misconfigurations likely [52] and in turn represents a vulnerability to potential attacks (e.g. privilege escalations) in the case of a less restrictive O2 interface.",FALSE,TRUE,,O2 Interface,Open RAN Risk Analysis
O2 Takeover (A),"O-RAN worst case/3GPP worst case (ww): Since no security mechanisms are mandatory, even an outsider can access the powerful O2 interface and take complete control of the RAN. This may result in a failure to fulfil the protection goal of availability for all the stakeholders considered. With regard to the end user, a failure to meet the protection goals of confidentiality, integrity and accountability of transmitted data must also be assumed, since the attacker can gain control over the relevant encryption keys. With regard to the 5G network operator/telco, failures to fulfil the protection goals of confidentiality, accountability and privacy are to be expected. This affects all data relevant to the O-RAN, such as configuration data (including cryptographic keys), machine learning models, O-RAN software components (including rApps and xApps), log files, etc. Since a corresponding attack can easily be carried out on a large scale, a high risk with regard to all protection goals can also be assumed for governmental (“state”) stakeholders. However, integrity is an exception from the network operator's point of view: even if a RAN is completely taken over, the Control Plane data between UE and AMF should be secured by the mandatory integrity assurance measures using 3GPP mechanisms.",FALSE,TRUE,,O2 Interface,Open RAN Risk Analysis
O2 Takeover (B),"O-RAN worst case/3GPP best case (wb): Here, the assessment of the risks is analogous to that of the worst-case/worst-case scenario. However, the Control Plane data is encrypted by the 3GPP specifications between UE and AMF in the best case, which means that the risk to the confidentiality protection objective can be classified as “medium” with regard to the “telco” stakeholder because the other O-RAN-specific Control Plane data is unprotected.",FALSE,TRUE,,O2 Interface,Open RAN Risk Analysis
O2 Takeover (C),"O-RAN best case/3GPP best case (bb): Since all the optional security safeguards are implemented in this case, a low probability of successful attacks by outsiders and users seeking to exploit the O2 interface can be assumed. With regard to “insider” attackers, on the other hand, a high probability can be assumed. Since there are no concrete statements on rights management or granular access control to the O2 interface, it can currently be assumed that insider attackers can expand their rights with relative ease. This is especially true if the component compromised by the insider is the SMO framework. By securing the O-RAN area, the risk of a failure to fulfil the availability protection goal should decrease, since incidental access to the O2 interface from the outside and by the user should no longer be possible.",FALSE,TRUE,,O2 Interface,Open RAN Risk Analysis
O2 Takeover (D),"O-RAN best case/3GPP worst case (bw): The risks of failures to meet the protection goals should be assessed here in the same way as the best-case/best-case scenario. The only difference is that no Control Plane data is encrypted between UE and AMF, which raises the risk from “medium” to “high”.",FALSE,TRUE,,O2 Interface,Open RAN Risk Analysis
O1 Insufficient Security,"Optional security safeguards are provided for the O1 interface in the current specification documents. Specifically, SSH and TLS are cited here [25]. The implementation of the least privilege principle is also mentioned. 

It should be noted that the Security Requirements document [51] makes more strictly formulated statements compared to the actual O1 interface specification: “O1 interface will enforce confidentiality, integrity, authenticity through an encrypted transport, and least privilege access control using the network configuration access control model”. However, some of the concrete requirements only use the phrase “shall support”, whereas the same document's notes on the security controls to be used are stricter: “As defined in the previous chapter, the O1 will use TLS 1.2 or higher to enforce confidentiality, integrity, and authenticity; and will use NACM [10] to enforce least privileged access”.",FALSE,TRUE,,O1 Interface,Open RAN Risk Analysis
O1 Takeover (General) (A),"O-RAN worst case/3GPP worst case (ww): Since no security mechanisms are mandatory and the O1 interface – at least with regard to the (O-)RAN core functionality – is similarly powerful to the O2 interface, the considerations from chapter 5.1 apply in the same way. However, the risk of an integrity violation is classified as medium from the network operator's point of view. Due to the mandatory integrity assurance of the Control Plane data (only NAS signals) on the part of 3GPP, it should not be possible for even an insider to change the Control Plane data exchanged between UE and AMF without being noticed. However, an insider still has access to the Control Plane data in the O-RAN, which is why the integrity violation is classified as medium.",FALSE,TRUE,,O1 Interface,Open RAN Risk Analysis
O1 Takeover (General) (B),"O-RAN worst case/3GPP best case (wb): Here, the consideration is similar to the worstcase/worst-case scenario: since integrity assurance of the Control Plane data exchanged between UE and AMF is mandatory, the 3GPP best case does not offer improvement compared to the 3GPP worst-case scenario. Although the UE's User Plane data is now encrypted and its integrity secured, an attacker can access the corresponding keys via the O1 interface, so the risk remains unchanged. An important difference, however, is that the Control Plane data between the UE and AMF is encrypted from end to end in this case. From the network operator's point of view, the risk here is therefore assessed as medium because regardless of all the other considerations, the O-RAN-specific Control Plane data is unencrypted.",FALSE,TRUE,,O1 Interface,Open RAN Risk Analysis
O1 Takeover (General) (C),"O-RAN best case/3GPP best case (bb): As in the case of the O2 interface, the circumstances regarding the O1 interface look better in the best case due to the (optional) security safeguards provided. In relation to “user” and “outsider” attackers, the risk of a breach of the protection goals of confidentiality, integrity and accountability is assessed as low for all stakeholders. In the case of availability, the risk for all stakeholders is rated as medium. An attacker could target the availability of the O1 interface to prevent configuration changes and status messages. This in turn can lead to impairments of the quality of service of the RAN – that is, to successful availability attacks on the RAN itself. It should be noted here that, in contrast to the specification of the E2 interface, a failure of the O1 interface is currently not explicitly considered in the specification documents. Since the O1 interface allows software management, an insider with access to this interface can in principle manipulate the executed O-RAN components and thus, as already detailed, gain access to stored cryptographic keys (for example) in the case of the O-CU. The decisive factor here is how strictly the least privileged principle is implemented and what rights a given insider actually has as a result. The risk an insider poses to the protection goals of confidentiality, integrity and accountability with regard to the “user” and “state” stakeholders is therefore assessed as medium. A similar assessment is made for the “telco” stakeholder. Although parts of Control Plane communication are secured from end to end (and thus protected against insider access), the O1 interface provides access to a great deal of network management information that is sensitive from the network operator's point of view (in terms of both confidentiality and integrity/accountability).",FALSE,TRUE,,O1 Interface,Open RAN Risk Analysis
O1 Takeover (General) (D),"O-RAN best case/3GPP worst case (bw): Although the safeguards provided by the 3GPP protection measures are not effective here, the same risks arise as in the best-case/best-case scenario, since “outsider” and “user” attackers have no access to the O1 interface in the O-RAN best case. With regard to “insider” attackers, on the other hand, the fact that the 3GPP security safeguards no longer apply has no negative impact because they were also not effective in the 3GPP best case.",FALSE,TRUE,,O1 Interface,Open RAN Risk Analysis
O1 Spec. Ambiguity,"In [53], the O1 interface between the O-DU and SMO is used for “start up” installation and the management of software, configurations, performance, faults and files. For the security of the connection, the use of TLS is to be mandatory for the authentication of the O-DU, although the mandatory nature is usually rarely found in the specifications in this way. In addition to this, securing the NETCONF data exchange by means of TLS is supposed to be mandatory: “In this version of O1 Interface Specification, the security of the NETCONF protocol is realized using TLS” [53].

Use of the NETCONF Access Control Model (NACM) is also supposed to be mandatory to enforce least-privilege access control. In general, the specification mainly covers the mandatory implementation of security mechanisms in contrast to the security mechanisms in 5.3.1.

Although the enforcement of the protection goals of confidentiality, integrity and accountability is not mentioned with the usual terminology using “shall”, the formulation: “[...] the O1 interface will enforce confidentiality, integrity, authenticity [...] and least privilege access control [...]”. [56] leads to the conclusion that the same meaning is intended.",FALSE,TRUE,,O1 Interface,Open RAN Risk Analysis
O1 Takeover (O-DU-SMO Interface) (A),"O-RAN worst case/3GPP worst case (ww): Since the interface is secured even in the worst case by the mandatory nature of the security safeguards, there is hardly any possibility (at least for “outsiders”) to gain read, and especially write, access to this interface. However, the basic availability attacks that prevent certain status and configuration messages cannot be prevented. As in the general assessment of the O1 interface, it can also be said that “user” attackers pose a low risk of violating the protection goals of confidentiality, integrity and accountability. An insider, on the other hand, can breach the protection goals of confidentiality, integrity and accountability in the worst case, since the O-RAN protection measures cannot compensate for the 3GPP safeguards that do not apply here. Here, the O-DU is assumed to be an “insider”. In addition, an insider may be able to install their own software on the O-DU in the worst case (depending on their membership in rights groups) and thereby gain control of it. This results in a high risk to availability. In spite of all this, however, an insider cannot break the integrity of the Control Plane data between UE and AMF, as it is secured by the mandatory 3GPP measures.",FALSE,TRUE,"O-DU, SMO",O1 Interface,Open RAN Risk Analysis
O1 Takeover (O-DU-SMO Interface) (B),"O-RAN worst case/3GPP best case (wb): Since all the measures to secure the protection goals are mandatory, the risks should be the same as in the “ww” case. From the perspective of 3GPP security, the confidentiality of the Control Plane data between UE and AMF is assured along with its integrity, which means that the risk posed by insiders can be classified as “medium”.",FALSE,TRUE,"O-DU, SMO",O1 Interface,Open RAN Risk Analysis
O1 Takeover (O-DU-SMO Interface) (C),"O-RAN best case/3GPP best case (bb): With regard to the best-case scenario, the assessment of “outsider” and “user” attackers is consistent with that of the worst-case scenario due to the mandatory nature of the O-RAN security safeguards. The 3GPP security safeguards can be said to prevent a violation of the protection goals of confidentiality, integrity and accountability only in cases involving “insider” attackers. With regard to availability, it can be argued that even in the best-case scenario, an insider cannot inject malware through NACM, as they do not have the necessary rights. Depending on one's point of view, however, they themselves can be O-DU, which means they can easily restrict availability.",FALSE,TRUE,"O-DU, SMO",O1 Interface,Open RAN Risk Analysis
O1 Takeover (O-DU-SMO Interface) (D),"O-RAN best case/3GPP worst case (bw): Here, the assessment of the risks is the same as in the previous “bb” case. In this scenario, only confidentiality is not secured by 3GPP in the Control Plane between UE and AMF, which is why the risk is assessed as “medium”.",FALSE,TRUE,"O-DU, SMO",O1 Interface,Open RAN Risk Analysis
A1 Interface Specification Gaps,"As described in chapter 2.3.3, the A1 interface is primarily used to communicate guidelines to the near-real-time RIC regarding the configuration/optimisation of the RAN. These guidelines are designed as declarative policies. They express what is to be achieved, but not how it should be achieved. The concrete implementation decisions are thus part of the near-real-time RIC and the xApps.

The A1 interface is meant to provide options for enforcing confidentiality, integrity and authenticity (including protection against replay attacks) [51]. For this purpose, TLS is provided as an option for securing communications [57], [51], [49]. One threat to the A1 interface arises from the fact that, in order to implement bidirectional communication, it is intended that both end points (non-real time RIC, near-real time RIC) of the A1 interface act as servers [57]. The attack surface resulting from the open ports necessary for this should be minimised by having only one endpoint act as a server and carrying out bidirectional communication via an existing connection. To implement this, additional techniques such as reverse connections can be used.

With regard to the best-case/worst-case analysis, it should be noted that the corresponding risks here are essentially dependent on the best-case/worst-case situation pertaining to the O-RAN specifications. In contrast, due to the functionality of the A1 interface, the resulting risk is largely independent of the best-case/worst-case situation regarding the 3GPP standards.",FALSE,TRUE,"Near-RT RIC, Non-RT RIC",A1 Interface,Open RAN Risk Analysis
A1 Interface Attack (Worst Case),"Worst case: Since the A1 interface is unsecured in the worst case, it is possible for outsiders to gain read and write access to it. By manipulating policies accordingly, an impairment of availability (reduction of service quality) is possible at the very least. A high risk to availability is thus assumed for all stakeholders.

With regard to the protection goals of confidentiality, integrity and accountability, a low risk is assumed for the user perspective even in the worst case, as no current attacks could be identified that would allow an attacker with access to the A1 interface to read or manipulate the User Plane data.

It should be noted here that more in-depth analyses are needed to actually rule out the possibility that no User Plane data is transmitted via the A1 interface. Particularly in future versions of the specifications, it will be essential to check which services are actually offered via the A1 interface and whether User Plane data is transmitted there.

With regard to the “telco” perspective, this risk assessment changes to “medium”, since sensitive network management information (with regard to confidentiality and integrity) is transmitted via the A1 interface. This assessment was also adopted for the “state” perspective.",FALSE,TRUE,,A1 Interface,Open RAN Risk Analysis
A1 Interface Attack (Best Case),"Best case: Due to the protection with TLS in the best case, neither an outsider nor a user can successfully attack the confidentiality or integrity of the A1 interface. Only availability attacks on the A1 interface are conceivable. Due to the functionality of the A1 interface, it can be assumed that intelligent availability attacks on this interface can impair the availability of the RAN – at least in the sense of a reduction in quality of service. This applies in particular because a failure of the A1 interface is not explicitly considered in the specifications. A medium risk is therefore assumed for all stakeholders here.

Since the security safeguards only provide protection against outsiders (connection encryption) and a rights and role concept regarding access control to the A1 interface can be inferred between the lines of the specification at best, it is currently assumed that an insider has full access to the A1 interface even in the best-case scenario. The situation pertaining to insider attackers is therefore similar to that of the worst case involving an outsider. On the other hand, no current attacks could be identified that would enable an insider to gain a significant advantage with regard to the protection goals of confidentiality, integrity and accountability based on access to the A1 interface. The comments made above regarding the need for a more in-depth analysis should be noted here.",FALSE,TRUE,,A1 Interface,Open RAN Risk Analysis
