Threat ID,Threat title,Threat agent,Vulnerability,Threatened Asset,Affected Components,Threat Type,Extra Interfaces
T-AIML-DP-03,White-box Data Poisoning,All,"Vulnerabilities in data sources, vulnerabilities in training database","ASSET-D-10, ASSET-D-25, 
 ASSET-D-26, ASSET-C-12,
 ASSET-C-02, ASSET-C-11, ASSET-C-22, ASSET-C-14,
 ASSET-C-40","Database holding data from xApp applications and E2 Node, Training or test data sets collected externally or internally, Trained ML model, xApps, rApps, Near-RT-RIC SW, Non-RT-RIC SW, O1 interface for streaming data, A1 interface, E2 interface for streaming data",General,
T-AIML-MEI-01,Information Access - Membership Inference,All,"Vulnerabilities in data sources, vulnerabilities in training database","ASSET-D-26, 
 ASSET-C-02, 
 ASSET-C-11","Trained ML model, xApps, rApps, Near-RT-RIC SW, Non-RT-RIC SW",General,
T-AIML-MEI-02,Inference Technique - Membership Inference,All,"Vulnerabilities in data sources, vulnerabilities in training database","ASSET-D-26, 
 ASSET-C-02, 
 ASSET-C-11","Trained ML model, xApps, rApps, Near-RT-RIC SW, Non-RT-RIC SW",General,
T-AIML-MEI-03,Target based - Membership Inference,All,"Vulnerabilities in data sources, vulnerabilities in training database","ASSET-D-26, 
 ASSET-C-02, 
 ASSET-C-11","Trained ML model, xApps, rApps, Near-RT-RIC SW, Non-RT-RIC SW",General,
T-AIML-ME-01,Intellectual Property Theft,All,"Vulnerabilities in data sources, vulnerabilities in training database, vulnerabilities in ML model storage, vulnerabilities in ML model transfer","ASSET-D-10, ASSET-D-25, ASSET-D-26, ASSET-C-02, ASSET-C-11","Database holding data from xApp applications and E2, Training or test data sets collected externally or internally, Trained ML model, Near-RT-RIC SW, Non-RT-RIC SW",General,
T-AIML-ME-02,Data Privacy Violations,All,"Vulnerabilities in data sources, vulnerabilities in training database, vulnerabilities in ML model storage, vulnerabilities in ML model transfer","ASSET-D-10, ASSET-D-25, ASSET-D-26, ASSET-C-02, ASSET-C-11","Database holding data from xApp applications and E2, Training or test data sets collected externally or internally, Trained ML model, Near-RT-RIC SW, Non-RT-RIC SW",General,
T-AIML-ME-03,Adversarial Attacks with Stolen Models,All,"Vulnerabilities in data sources, vulnerabilities in training database, vulnerabilities in ML model storage, vulnerabilities in ML model transfer","ASSET-D-10, ASSET-D-25, ASSET-D-26, ASSET-C-02, ASSET-C-11","Database holding data from xApp applications and E2, Training or test data sets collected externally or internally, Trained ML model, Near-RT-RIC SW, Non-RT-RIC SW",General,
T-AIML-MOI-01,Black-box Model Inversion,All,"Model is overfitted, model may have memorized specific training examples, model API not properly protected","ASSET-D-10, ASSET-D-25, ASSET-D-26, ASSET-D-27","Near-RT RIC, Non-RT RIC, xAPPs, rApps",General,
T-AIML-MOI-02,White-box Model Inversion,All,"Model is not protected, training data is not protected, model is overfitted, model may have memorized specific training examples, model API not protected","ASSET-D-10, ASSET-D-25, ASSET-D-26, ASSET-D-27, ASSET-D-28","Near-RT RIC, Non-RT RIC, xAPPs, rApps",General,
T-AIML-SC-01,Data Poisoning via Supply Chain,All,"Vulnerabilities in data sources, vulnerabilities in training database, vulnerabilities in ML model transfer","ASSET-D-10, ASSET-D-25, ASSET-D-26, ASSET-C-02, ASSET-C-11, ASSET-C-12","Database holding data from xApp applications and E2 Node, Training or test data sets collected externally or internally, Trained ML model, ML components deploying machine learning (xApps, rApps),Near-RT-RIC SW, Non-RT-RIC SW",General,
T-AIML-SC-02,Model Tampering,All,Vulnerabilities in ML model transfer,"ASSET-D-10, ASSET-D-25, ASSET-D-26, ASSET-C-02, ASSET-C-11, ASSET-C-12","Database holding data from xApp applications and E2 Node, Training or test data sets collected externally or internally, Trained ML model, ML components deploying machine learning (xApps, rApps),Near-RT-RIC SW, Non-RT-RIC SW",General,
T-AIML-SC-03,Backdoor via Supply Chain,All,Vulnerabilities in ML model transfer,"ASSET-D-10, ASSET-D-25, ASSET-D-26, ASSET-C-02, ASSET-C-11, ASSET-C-12","Database holding data from xApp applications and E2 Node, Training or test data sets collected externally or internally, Trained ML model, ML components deploying machine learning (xApps, rApps),Near-RT-RIC SW, Non-RT-RIC SW",General,
T-AIML-SC-04,Hardware Tampering,All,Vulnerabilities in the AI processing HW,"ASSET-D-10, ASSET-D-26, ASSET-C-02, ASSET-C-11, ASSET-C-12","Database holding data from xApp applications and E2 Node, Trained ML model, ML components deploying machine learning (xApps, rApps),Near-RT-RIC SW, Non-RT-RIC SW",General,
T-AIML-SC-05,Insecure Maintenance APIs,All,Vulnerabilities in the ML maintenance APIs,"ASSET-D-10, ASSET-D-25, ASSET-D-26, ASSET-C-02, ASSET-C-11, ASSET-C-12","Database holding data from xApp applications and E2 Node, Training or test data sets collected externally or internally, Trained ML model, ML components deploying machine learning (xApps, rApps),Near-RT-RIC SW, Non-RT-RIC SW",General,
T-AIML-SC-06,Third-party Libraries and Dependencies,All,Vulnerabilities in the ML- related SW,"ASSET-D-10, ASSET-D-25, ASSET-D-26, ASSET-C-02, ASSET-C-11, ASSET-C-12","Database holding data from xApp applications and E2 Node, Training or test data sets collected externally or internally, Trained ML model, ML components deploying machine learning (xApps, rApps),Near-RT-RIC SW, Non-RT-RIC SW",General,
T-AIML-OI-01,Denial of Service Impacting Output Integrity,All,"Vulnerabilities in data sources, vulnerabilities in training database, vulnerabilities in ML model storage, vulnerabilities in ML model transfer","ASSET-D-25,ASSET-D-26, ASSET-D-27, ASSET-D-07,ASSET-C-12,
 ASSET-C-02, ASSET-C-11","Training or test data sets collected externally or internally, Trained ML model, ML prediction results,A1 policies,E2 node data, Near-RT-RIC SW, Non-RT-RIC SW",General,
T-AIML-OI-02,Subscriber QoE Change,All,"Vulnerabilities in data sources, vulnerabilities in training database, vulnerabilities in ML model storage, vulnerabilities in ML model transfer.","ASSET-D-25, 
 ASSET-D-26, ASSET-D-27, ASSET-D-07, ASSET-D-11,ASSET-C-02,
 ASSET-C-02, ASSET-C-11","Training or test data sets collected externally or internally, Trained ML model ,
 ML prediction results ,Data transported over the O1 interface,A1 policies,
 E2 node data, Near-RT-RIC SW, Non-RT-RIC SW .",General,
T-AIML-MP-01,Model Parameter Poisoning,All,"• Insufficient access controls to the model’s parameters [i.33]
 • Inadequate monitoring and logging of model’s activity [i.32]
 • Lack of control for poisoning in model [i.32]
 • Weak access protection mechanisms for ML model components [i.32]","[ASSET-D-26], [ASSET-C-12], [ASSET-D-27]","Near-RT RIC, Non-RT RIC, O-CU, O-DU, xApps, rApps",General,
T-AIML-MP-02,Inference Algorithm Poisoning,All,"• Insufficient access controls to the model’s code [i.33]
 • Inadequate monitoring and logging of model’s activity [i.32]
 • Lack of code integrity checking
 • Weak access protection mechanisms for ML model components [i.32]","[ASSET-D-26], [ASSET-D-27]","Near-RT RIC, Non-RT RIC, O-CU, O-DU, xApps, rApps",General,
T-AIML-MP-03,Learning Algorithm Poisoning,All,"• Insufficient access controls to the model’s code [i.33]
 • Inadequate monitoring and logging of model’s activity [i.32]
 • Weak access protection mechanisms for ML model components [i.32]
 • Lack of code integrity checking",[ASSET-C-12],"Near-RT RIC, Non-RT RIC, xApps, rApps",General,
T-AIML-MP-04,Model Control,All,"Vulnerabilities in ML model storage, vulnerabilities in ML model transfer","ASSET-D-12, ASSET-D-26, ASSET-D-27, ASSET-D-28","Near-RT RIC, Non-RT RIC, xAPPs, rApps",General,
T-AIML-MS-01,Data Manipulation for Model Skewing,All,"Vulnerabilities in (i) training data validation, (ii) less robust model training against cyber-attacks, (iii) less model performance monitoring for monitoring of suspicious activity","ASSET-D-26, 
 ASSET-D-27, 
 ASSET-D-28","Trained ML model, xApps, rApps, Near-RT-RIC SW, Non-RT-RIC SW",General,
T-AIML-MS-02,Feedback Manipulation for Model Skewing,All,"Vulnerabilities in (i) less secure feedback mechanisms to prevent manipulation, (ii) less robust model training against cyber-attacks, (iii) less model performance monitoring for monitoring of suspicious activity","ASSET-D-26, 
 ASSET-D-27, 
 ASSET-D-28","Trained ML model, xApps, rApps, Near-RT-RIC SW, Non-RT-RIC SW",General,
T-AIML-TL-01,Data Poisoning for Transfer Learning,All,"Vulnerabilities in data sources, 
 Vulnerabilities in training database","ASSET-D-10, ASSET-D-25, ASSET-D-26, ASSET-C-02, ASSET-C-11, ASSET-C-12","Database holding data from xApp applications and E2 Node, Training or test data sets collected externally or internally, Trained ML model, ML components deploying machine learning (xApps, rApps),Near-RT-RIC SW, Non-RT-RIC SW",General,
T-AIML-TL-02,Model Stealing for Transfer Learning,All,"Vulnerabilities in data sources, 
 Vulnerabilities in training database, 
 Vulnerabilities in ML model storage, 
 Vulnerabilities in ML model transfer","ASSET-D-10, ASSET-D-25, ASSET-D-26, ASSET-C-02, ASSET-C-11, ASSET-C-12","Database holding data from xApp applications and E2 Node, Training or test data sets collected externally or internally, Trained ML model, ML components deploying machine learning (xApps, rApps),Near-RT-RIC SW, Non-RT-RIC SW",General,
T-AIML-TL-03,Adversarial Examples,All,"Vulnerabilities in data sources, 
 Vulnerabilities in training database, 
 Vulnerabilities in ML model storage, Vulnerabilities in ML model transfer","ASSET-D-10, ASSET-D-25, ASSET-D-26, ASSET-C-02, ASSET-C-11","Database holding data from xApp applications and E2 Node, Training or test data sets collected externally or internally, Trained ML model, Near-RT-RIC SW, Non-RT-RIC SW",General,
T-AIML-TL-04,Backdoor for Tranfer Learning,All,Vulnerabilities in ML model transfer,"ASSET-D-10, ASSET-D-25, ASSET-D-26, ASSET-C-02, ASSET-C-11, ASSET-C-12","Database holding data from xApp applications and E2 Node, Training or test data sets collected externally or internally, Trained ML model, ML components deploying machine learning (xApps, rApps),Near-RT-RIC SW, Non-RT-RIC SW",General,
T-AIML-EL-01,Model Extraction,All,Vulnerabilities in data sources,"ASSET-D-10, ASSET-D-26, ASSET-C-02, ASSET-C-11, ASSET-C-29, ASSET-30","Database holding data from xApp applications and E2 Node, Trained ML model, Near-RT-RIC SW, Non-RT-RIC SW, AAL software, Hardware accelerator device firmware",General,
T-AIML-EL-02,Data Inference,All,Vulnerabilities in data sources,"ASSET-D-10, ASSET-C-02, ASSET-C-11, ASSET-C-29, ASSET-30","Database holding data from xApp applications and E2 Node, Near-RT-RIC SW, Non-RT-RIC SW, AAL software, Hardware accelerator device firmware",General,
T-AIML-EL-03,Denial of Service via Side Channels,All,Vulnerabilities in data sources,"ASSET-D-10, ASSET-D-26, ASSET-C-02, ASSET-C-11, ASSET-C-29, ASSET-30","Database holding data from xApp applications and E2 Node, Trained ML model, Near-RT-RIC SW, Non-RT-RIC SW, AAL software, Hardware accelerator device firmware",General,
T-AIML-EV-01,Grey-box based Data Evasion,All,"Vulnerabilities in the input APIs of the AI ML model application
 Vulnerabilities in the source of input data used by AI ML for inferences","ASSET-D-10, ASSET-D-25, ASSET-D-26, ASSET-C-02, ASSET-C-11","Database holding data from xApp applications and E2 Node, Training or test data sets collected externally or internally, Trained ML model, Near-RT-RIC SW, Non-RT-RIC",General,
T-E2-01,Untrusted Near-RT-RIC and E2 Nodes,All,weak mutual authentication,ASSET-C-40,E2 interface,General,
T-E2-02,Malicious actor monitors messaging across E2 interface,All,Missing or weak confidentiality protection,ASSET-C-40,E2 interface,General,
T-E3-03,Malicious actor modifies messaging across E2 interface,All,Lack of integrity verification,ASSET-C-40,E2 interface,General,
T-Y1-01,Untrusted Near-RT-RIC and Y1 consumers,All,weak mutual authentication,ASSET-C-42,Y1interface,General,
T-Y1-02,Malicious actor monitors messaging across Y1 interface,All,Missing or weak confidentiality protection,ASSET-C-42,Y1 interface,General,
T-Y1-03,Malicious actor modifies messaging across Y1 interface,All,Lack of integrity verification,ASSET-C-42,Y1 interface,General,